{
    "schema": "study-card.v2",
    "task_id": "20261005-market-context-handoff",
    "kind": "tooling",
    "question": "0050 背景資料與交接完成了什麼？",
    "answer": "這份交接保留背景資料的可用性、研究紀錄與後續建議。",
    "verdict": "not_evaluated",
    "data_period": null,
    "key_numbers": [],
    "limitation": "本輪沒有新選股實驗、帳戶回測或策略通過結論。",
    "report": {
        "web_report": null,
        "markdown": "report.md"
    },
    "account_run": null,
    "delivery_state": null,
    "scratch_run": null,
    "provenance": {
        "answer_source": "時點說明（2026-10-05 補記）：以下保留本次交接完成時的狀態與建議。\n後續研究進度以 [研究總覽](../../docs/en/research-program.md) 為準；其中方法交互\n與 H03 比較已有完成紀錄，勿把本報告末段的當時建議當成待重做清單。",
        "report_sha256": "cc06fa744ac52ec5643b8129c5ad7f0863db23c9f372b6ccefcc851ce6af3bb6",
        "publication": null,
        "shared_data": [],
        "legacy_history_id": "20261005-market-context-handoff"
    }
}
