{
    "schema": "study-card.v2",
    "task_id": "20261002-weekly-rank-exit",
    "kind": "study",
    "question": "週頻排行榜出場是否通過這次比較？",
    "answer": "這個週頻設定未通過預先訂下的損失與風險條件，因此停止此設定。",
    "verdict": "failed",
    "data_period": null,
    "key_numbers": [],
    "limitation": "這只代表本次週頻設定失敗，不代表所有週頻或動能方法都無效。",
    "report": {
        "web_report": null,
        "markdown": "execution-v2.md"
    },
    "account_run": null,
    "delivery_state": "research_complete",
    "scratch_run": null,
    "provenance": {
        "answer_source": "Close this exact weekly configuration. No weekday/fortnight/rank/add-filter/grace\nrescue, delayed/omitted/best-trade extra account, independent confirmation or\nfinal adoption. This is a candidate failure with complete valid measurement,\nnot another source blocker or execution failure. It does not establish that\nevery weekly strategy or every momentum approach fails.",
        "report_sha256": "3a485c1daa844b8618a28508ff6d2dde88784aa0541ad368da19d43911def97e",
        "publication": null,
        "shared_data": [],
        "legacy_history_id": null
    }
}
