{
    "schema": "study-card.v2",
    "task_id": "20261027-multi-timeframe-ma",
    "kind": "study",
    "question": "日線轉強、整週轉強或週均線密集，能更早找到大漲機會嗎？",
    "answer": "規劃中：先固定四種日／週訊號與公平比較方式，等待擁有者合併定義，並另行確認資料與計算關卡。",
    "verdict": "not_evaluated",
    "data_period": null,
    "key_numbers": [],
    "limitation": "尚未執行研究；歷史期間已看過，未來即使找到訊號優勢，也不等於實際投資報酬或策略核准。",
    "report": {
        "web_report": null,
        "markdown": null
    },
    "account_run": null,
    "delivery_state": null,
    "scratch_run": null,
    "provenance": {
        "answer_source": null,
        "report_sha256": null,
        "publication": null,
        "shared_data": [],
        "legacy_history_id": null
    }
}
