{
    "schema": "study-card.v2",
    "task_id": "20261021-momentum-only-doubling",
    "kind": "study",
    "question": "只看強勢條件，翻倍與下跌風險如何？",
    "answer": "強勢條件的翻倍比例高於基準，但未翻倍又收低的比例也更高，呈現報酬與風險並存。",
    "verdict": "mixed",
    "data_period": {
        "from": "2010-01-04",
        "to": "2026-10-12"
    },
    "key_numbers": [
        {
            "label": "CORE半年翻倍率",
            "value": 14.5,
            "unit": "percent",
            "highlight": true,
            "source_excerpt": "- **只看強勢條件、不看型態，半年內翻倍的比例明顯高於任何一天。** CORE（收盤高於年線 60% 以上，且是一年內最低收盤的 2.5 倍以上）\n  半年翻倍 14.5%，全市場任何合格股票日 3.9%（3.76 倍）；再加當天漲停的 LEAD_B1 是 18.8%（4.88 倍）。\n  一年翻倍分別是 18.2%、21.7%，基準 9.8%。兩種 bootstrap 區間都同意翻倍率高於基準，也高於「創 52 週新高且放量」。"
        },
        {
            "label": "CORE未翻倍收低",
            "value": 53.1,
            "unit": "percent",
            "highlight": false,
            "source_excerpt": "- **但「沒翻倍又收低」的也更多。** 期限內沒有翻倍、且期末收盤低於起點的比例（先翻倍後又跌回起點以下的算翻倍，不算在這裡）：CORE 半年 53.1%、一年 60.1%；LEAD_B1 半年 52.5%、一年 60.1%；\n  基準是 47.3%、45.1%。一年期兩種區間都同意這個比例較高；半年期只有股票重抽區間同意。\n  強勢條件挑出的是高波動股票：翻倍和「沒翻倍又收低」同時變多，不是穩賺的訊號。"
        }
    ],
    "limitation": "這是已看過歷史的描述性比較，條件由同一期間選出，不能當成因果或策略核准。",
    "report": {
        "web_report": "web-report/index.html",
        "markdown": "report.md"
    },
    "account_run": null,
    "delivery_state": null,
    "scratch_run": null,
    "provenance": {
        "answer_source": "- **只看強勢條件、不看型態，半年內翻倍的比例明顯高於任何一天。** CORE（收盤高於年線 60% 以上，且是一年內最低收盤的 2.5 倍以上）\n  半年翻倍 14.5%，全市場任何合格股票日 3.9%（3.76 倍）；再加當天漲停的 LEAD_B1 是 18.8%（4.88 倍）。\n  一年翻倍分別是 18.2%、21.7%，基準 9.8%。兩種 bootstrap 區間都同意翻倍率高於基準，也高於「創 52 週新高且放量」。\n- **但「沒翻倍又收低」的也更多。** 期限內沒有翻倍、且期末收盤低於起點的比例（先翻倍後又跌回起點以下的算翻倍，不算在這裡）：CORE 半年 53.1%、一年 60.1%；LEAD_B1 半年 52.5%、一年 60.1%；\n  基準是 47.3%、45.1%。一年期兩種區間都同意這個比例較高；半年期只有股票重抽區間同意。\n  強勢條件挑出的是高波動股票：翻倍和「沒翻倍又收低」同時變多，不是穩賺的訊號。",
        "report_sha256": "7018d6896ae7384dddba02492b6f122f23eed9b215b9f3b357cbde2e5a83d545",
        "publication": null,
        "shared_data": ["adjusted-daily-v1"],
        "legacy_history_id": null
    }
}
