{
    "schema": "study-card.v2",
    "task_id": "20261002-entry-persistence",
    "kind": "study",
    "question": "延長進場確認時間能否通過固定的探索篩選？",
    "answer": "四項條件必須全部通過，但這個設定未通過，因此停止推進此做法。",
    "verdict": "failed",
    "data_period": null,
    "key_numbers": [],
    "limitation": "此失敗只適用於已測設定，尚未做延遲成交或獨立樣本確認。",
    "report": {
        "web_report": null,
        "markdown": "execution-v3.md"
    },
    "account_run": null,
    "delivery_state": null,
    "scratch_run": null,
    "provenance": {
        "answer_source": "All four were required: **this exact configuration fails the fixed exploratory\nscreen and is closed**. This is a completed candidate failure with a limited\nglobal descriptive statistic, not execution incompletion or invalid measurement.",
        "report_sha256": "00185e2361d32a14a82801bdfc3b1ab319b592d967fa4d6f754ad26e2e9883a1",
        "publication": null,
        "shared_data": [],
        "legacy_history_id": null
    }
}
