{
    "schema": "study-card.v2",
    "task_id": "20260816-kline-strategy-category-fit",
    "kind": "study",
    "question": "三種 K 線買法放到不同產業，效果如何？",
    "answer": "多數組合不如直接持有；只有動能突破搭配航運在兩段期間都勝出。",
    "verdict": "mixed",
    "data_period": null,
    "key_numbers": [],
    "limitation": "這是有限組合的歷史比較，不代表其他產業或未來表現。",
    "report": {
        "web_report": null,
        "markdown": "report.md"
    },
    "account_run": null,
    "delivery_state": null,
    "scratch_run": null,
    "provenance": {
        "answer_source": "這次研究的摘要：大多贏不了直接買進抱著；15 種組合裡只有「動能突破 × 航運」在兩段期間都贏。",
        "report_sha256": "6912769e648b5f6873f0d25aa47973194eed3ce6ecf3314ce5994efe2fcdea8a",
        "publication": null,
        "shared_data": [],
        "legacy_history_id": "20260816-kline-strategy-category-fit"
    }
}
